{
  "version": "phase-5-round1",
  "sync_jobs": [
    {
      "job_id": "job-clawhub-001",
      "source_id": "src-clawhub-example",
      "trigger_type": "scheduled",
      "job_state": "completed",
      "started_at": "2026-04-28T11:00:00+01:00",
      "ended_at": "2026-04-28T11:04:00+01:00"
    }
  ],
  "snapshots": [
    {
      "snapshot_id": "snap-clawhub-prev",
      "source_id": "src-clawhub-example",
      "source_version_ref": "crawl-2026-04-21",
      "fetched_at": "2026-04-21T11:03:00+01:00",
      "fetch_state": "fetched",
      "inventory_ref": "inventory-clawhub-prev.json"
    },
    {
      "snapshot_id": "snap-clawhub-cur",
      "source_id": "src-clawhub-example",
      "source_version_ref": "crawl-2026-04-28",
      "fetched_at": "2026-04-28T11:03:00+01:00",
      "fetch_state": "fetched",
      "inventory_ref": "inventory-clawhub-cur.json"
    }
  ],
  "change_sets": [
    {
      "change_set_id": "chg-clawhub-001",
      "source_id": "src-clawhub-example",
      "previous_snapshot_id": "snap-clawhub-prev",
      "current_snapshot_id": "snap-clawhub-cur",
      "change_summary": [
        "package-added",
        "unit-added",
        "unit-modified"
      ]
    }
  ],
  "reprocessing_plans": [
    {
      "plan_id": "plan-clawhub-001",
      "source_id": "src-clawhub-example",
      "actions": [
        "rerun-inventory",
        "rerun-extraction",
        "rerun-taxonomy",
        "rerun-tagging",
        "rerun-scoring",
        "rerun-results-surface",
        "rerun-runtime-index-hints"
      ]
    }
  ]
}
